Name,Price,Review,ReviewRating,Photo
Kien Giang Restaurant,$$,I live few-min walk away from the restaurant but finally decided to give it a try. Tbh I was a little skeptical as I had the idea that a Vietnamese...,4,https://s3-media3.fl.yelpcdn.com/bphoto/DdGOnV4F58PT2cDG-1i_sA/o.jpg
Beantown Pho & Grill,$$,"Cute and cozy hole in the wall with delicious food.

Keep an eye out for Beantown Pho and Grill the next time you walk down Newbury St. If you're not paying...",5,https://s3-media2.fl.yelpcdn.com/bphoto/vaLclH4XZ38lHaSLb6sP5Q/o.jpg
Pho 2000,$,Came here with my friends and got the seven course beef which is basically 7 different meat dishes. Two of them you cook yourself by dipping the meat in...,5,https://s3-media2.fl.yelpcdn.com/bphoto/91A9ysW92ZpgYFa8xp_N-A/o.jpg
Pho So 1 Boston,$,"I highly recommend the Bo Ne. My four star is for this dish alone. This is beef steak sautéed onion with butter, pate, and a sunny side up egg. It is served...",4,https://s3-media3.fl.yelpcdn.com/bphoto/m7cd1Rui3dblu_w0Wj4euA/o.jpg
New Saigon Sandwich,$,"TLDR: killer take out banh mi. Cash only 

Love this place. Sandwiches are $5 with tax. I haven't tried all the varieties yet but the ones I've tried are...",5,https://s3-media2.fl.yelpcdn.com/bphoto/_OGHZyUwAHbjHeBbtyzQyw/o.jpg
Le's Vietnamese Resturant,$$,"Great portion, authentic pho and friendly quick service. Worth a visit! 

The menu is expansive and good quality.",5,https://s3-media1.fl.yelpcdn.com/bphoto/tiJRA3JfI3YHi-9oxIZKoA/o.jpg
Bon Me,$$,"Great, cheap, tasty meal.  I love the spicy peanut sauce with miso braised pork over soba noodles.  I've had it a million times and will have it a million...",4,https://s3-media2.fl.yelpcdn.com/bphoto/K9urfG2q028mtyd73u4-yw/o.jpg
Bon Me,$,"Love Vietamese food, and finding this food truck was a happy serendipity.

Bon Me happened to be in my pathway on my way back to my hotel, where I was going...",4,https://s3-media3.fl.yelpcdn.com/bphoto/8On64m6yBTwgYjvy9VQOIA/o.jpg
Anh Hong,$$,"One of the best places to get Vietnamese food. Saddened by their closure and hope that local and regional food cuisines can survive here in Boston.

Until...",5,https://s3-media1.fl.yelpcdn.com/bphoto/vxouIMMibBgPal1wNdpwnw/o.jpg
Sophia's Greek Pantry,$$,"Best. Yogurt. Ever. If all the other reviews don't convince you to come try it out, let it be mine that screams from the rooftops, This is better than...",5,https://s3-media2.fl.yelpcdn.com/bphoto/FTS3BBMZvUBbxA4_1iLIHA/o.jpg
Bella Ravioli,$,Great fresh ravioli and pasta. I definitely will be back soon to try some more kinds.,5,https://s3-media2.fl.yelpcdn.com/bphoto/nIaz07SngbDphdIYksgI3A/o.jpg
Greek International Food Market,$$,"Food - you get a great variety and high quality Mediterranean food. I was so happy to find all kinds of wheat, fresh salad, cheese, pastry. 

Ambiance -...",5,https://s3-media2.fl.yelpcdn.com/bphoto/LGUMm0Uc41Yt100ubtaSlQ/o.jpg
Armenian Market & Bakery,$,Drove all the way here just for baklava. Read on yelp that this place is the best place to go for it. Was not disappointed!!!  $13.99/ lb. not too bad. We...,5,https://s3-media4.fl.yelpcdn.com/bphoto/Ejb-ejEPKUUCv3RQ1BqqxQ/o.jpg
Bazaar On Cambridge,$$,My boyfriend and I went here to just check it out to see what they had and BOY were we surprised. The space looks small from the street but extends far back...,5,https://s3-media2.fl.yelpcdn.com/bphoto/UQTngUrRqfVaI1_iXTGPng/o.jpg
Reliable Market,$$,"This place is magic.

It's super unassuming, and I've definitely walked right by it even when I've been looking for it.  The name ""Reliable Market"" makes me...",5,https://s3-media1.fl.yelpcdn.com/bphoto/OObOpKqEVrXqGaE1wESpsw/o.jpg
Euromart,$$,"I really kind of want to keep this simple.  Two questions.

1) Do you like pierogies?
2) Do you like kielbasa?

If the answer to either one of those...",5,https://s3-media2.fl.yelpcdn.com/bphoto/rqYXrvGFBhJ9YY-TrGgorg/o.jpg
Lucky Shamrock,$$,Great source for Euro Cadbury chocalates. We visited 2 weeks before Easter and there were so many fun bunny themed chocolates! Aero choc and so many others...,5,https://s3-media2.fl.yelpcdn.com/bphoto/crqxvJYIW7vBbLL6hnoluA/o.jpg
Tapatio Mexican Grill,$,"Authentic and fresh! The menu has a good amount of options. 

The tacos and burritos are staples and are delicious. Pollo asado is also a good choice, for...",5,https://s3-media3.fl.yelpcdn.com/bphoto/_DBMhc7GZvXWyRObcs8L8w/o.jpg
Arax Market,$$,For a long time after arriving in he Boston-Cambridge area my friends recommended this place for me.  I am an adventurous cook and always need rare spices...,5,https://s3-media4.fl.yelpcdn.com/bphoto/IeVJt8yZWZdcY2KCXRwPSA/o.jpg
Baltic Deli & Cafe,$,Looking for Polish sausages we found this place. Friendly service and a nice selection of Polish foods and meats! We will be back!,5,https://s3-media4.fl.yelpcdn.com/bphoto/24YaYnpGbjz3QXwh59_A1A/o.jpg
Eastern Lamejun Bakers,$,"The Lamejun (not sure which spelling to use, there are so many) is fantastic. The bouregs are amazing Great selection and a long-time staple.",5,https://s3-media2.fl.yelpcdn.com/bphoto/-fBExemYC8AKmRylmFexYw/o.jpg
Lithuanian Kitchen,$,After a fun and fabulous night at Ryan Landry's gold dust orphans show up on the third floor we wandered down to find the basement  kitchen. Our first time...,5,https://s3-media1.fl.yelpcdn.com/bphoto/G31gGQiOSIXmCqZAea6lFg/o.jpg
Saté Asian Grill,$,"I love this awesome lunch place in the Nonprofit Center building!

I'm spoiled by delicious made to order food without having to leave my office...",4,https://s3-media4.fl.yelpcdn.com/bphoto/owjCLsy0gQl_92NRQqbb_g/o.jpg
El Madina,$,"Unfortunately I wasted my money. I ordered chicken kabob and falafel but in my opinion if I went to McDonalds I will eat better food.  

I am sure those who...",1,https://s3-media3.fl.yelpcdn.com/bphoto/IDrKuHEUEDFCI109GMexVA/o.jpg
The Shops at Porter,$,"I lived in Cambridge for 2 years in the late 90s while doing postdoc (i.e. Post Doctoral Research, a fancy term for unemployed person with a Ph.D. degree,...",5,https://s3-media1.fl.yelpcdn.com/bphoto/Dh96T1JSCfQt7YRezpCIVQ/o.jpg
Bazaar International Gourmet,$,"Excellent people and excellent crevice! 
I worked at that place for two years and I know the business form inside. The owner always do his best to provide...",5,https://s3-media1.fl.yelpcdn.com/bphoto/A_dWJqjGRowWVU0duXhTFA/o.jpg
C Mart Supermarket,$,"Most of these stars are for how convenient this place is.  A couple blocks from South Station, has parking, isn't usually too insane.  It already starts...",5,https://s3-media3.fl.yelpcdn.com/bphoto/6YqrdGxcPni9SHDH2ubQrQ/o.jpg
Bonne Chance Cafe,$,"Wow this was great food! A friendly man welcomed us at the door and we were seated nearly immediately, service was prompt and the food was absolutely...",5,https://s3-media2.fl.yelpcdn.com/bphoto/4jUaGu4w_Ceie3k2oU7BIg/o.jpg
