Name,Price,Review,ReviewRating,Photo
Cha Yen Thai Cookery,$$,They have changed their menu slightly. Our take-out consisted of the corn cake appetizer: YOU MUST TRY THIS! IT IS INCREDIBLE!!! So light and naturally...,5,https://s3-media1.fl.yelpcdn.com/bphoto/XfjXa45gHcAP1_MZSe9NJg/o.jpg
Maekha Thai,$$,"Authentic, reasonable Thai in Revere? Go figure.  Stopped here after Boston Comicon, (can you tell I'm a closet geek)?  The food was excellent, I ordered...",4,https://s3-media2.fl.yelpcdn.com/bphoto/VV54kfNOa-fSJYMcnp6fqA/o.jpg
Fusion Bistro,$$,Fun Chelsea spot with an AMAZING atmosphere and tasty foods. The little touches (like watermelon slices in the water) are really charming and feel pampering...,5,https://s3-media1.fl.yelpcdn.com/bphoto/d_rsg48fdO4iHSAxx9MADg/o.jpg
Siam Ginger,$$,"The Thai food and drink was amazing and had the perfect amount of spiciness. Great food service as well until they got buay, which is to be expected. Great...",5,https://s3-media4.fl.yelpcdn.com/bphoto/RZQZWzgSyk2WGVUHsdiF4w/o.jpg
S & I Thai,$$,Updating my review from a few years ago to say that they recently got a new server who makes this spot go from great to outstanding! She puts so much care...,5,https://s3-media3.fl.yelpcdn.com/bphoto/qFIMjtDE6nCiRxBsipxGdA/o.jpg
Rod Thai Family Taste,$$,"I used to come here a lot while I was in college because it was convenient.  it's not eh best Thai place I've been to, but it's SOLID.  

They have a really...",4,https://s3-media2.fl.yelpcdn.com/bphoto/NHuPZBMs3Je76Uxwr3MAHQ/o.jpg
Pho Basil,$$,Pho has some of the best stir fried noodles in Boston. Totally worth the $17 because of the taste and size of the plate. The noodles are clearly homemade...,5,https://s3-media3.fl.yelpcdn.com/bphoto/o5SyYRWPu3Bf8tCvn5qLMw/o.jpg
Rod Dee,$,"Rod Dee is a pretty awesome, no frill and affordable Thai restaurant near Porter Square. I like that their menu is huge and they have some of the harder to...",4,https://s3-media2.fl.yelpcdn.com/bphoto/dTHWRj-RuXArPYD4Soc1SQ/o.jpg
Brown Sugar Cafe,$$,Came here with a reservation on a Saturday night for a birthday and we had no issues getting seated. The space wasn't too busy so we could've done without...,4,https://s3-media2.fl.yelpcdn.com/bphoto/SmIXxYDxY96Sh3cIEN879g/o.jpg
Dok Bua Thai Kitchen,$$,"A spacious, authentic Thai restaurant with a family feel and ambiance located conveniently in Brookline. There is neighborhood parking and paid street...",4,https://s3-media3.fl.yelpcdn.com/bphoto/rDPw6mSLfs5wIQfh1pZnjg/o.jpg
Lemon Thai Cuisine,$$,"Was in work and went to go order from Similans (our go to at work) and they have permanently closed, so another co-worker suggested here! 

OMG so glad they...",4,https://s3-media1.fl.yelpcdn.com/bphoto/3FAcvkwi47P9g1pub_d8-Q/o.jpg
Beantown Pho & Grill,$$,"Cute and cozy hole in the wall with delicious food.

Keep an eye out for Beantown Pho and Grill the next time you walk down Newbury St. If you're not paying...",5,https://s3-media2.fl.yelpcdn.com/bphoto/vaLclH4XZ38lHaSLb6sP5Q/o.jpg
The Similans,$$,"This is still my go to and golden standard for great Thai food. Menu is extensive, and they never fail. 

Ordered takeout tonight but service was still...",5,https://s3-media2.fl.yelpcdn.com/bphoto/8JoDFPLiLjW73WQpter64A/o.jpg
Pad Thai Cafe,$,"I can't believe it took me more than a year to finally come here, when it's 5 min walk from my apt. Never looked like much from the outside so didn't think...",4,https://s3-media1.fl.yelpcdn.com/bphoto/ALFgfNr50IKVMU5p8E3NrQ/o.jpg
My Thai Vegan Cafe,$$,"PROS: Fantastic food, cute plants and atmosphere, great prices
CONS: Slow service

I love this place! I've been here so many times that I've tried most of...",5,https://s3-media2.fl.yelpcdn.com/bphoto/MuihDepeEZ3LTPhW29nckg/o.jpg
Lanta Asian Cuisine,$,"I ordered takeout today for lunch and it arrived about ten minutes ahead of schedule, nice and hot. Fresh, spicy, delicious. Good portions, too!

I got the...",4,https://s3-media1.fl.yelpcdn.com/bphoto/NeqMG2uYVsAG1iWRsb6tgg/o.jpg
Thaitation,$$,"Miss this place.    Used to live over here. Best Thai food in Boston.  There, I said it. 

I used to come here most days.... Some days, I'd eat lunch AND...",5,https://s3-media4.fl.yelpcdn.com/bphoto/tyA-_2YR1BRxRwxTPd8f8A/o.jpg
Nud Pob Thai Cuisine,$$,"Delicious, quick lunch near BU campus. $11.78 for a Pad See Ew, coming out to $12.5 pre tip. The staff is super understanding of allergies-- they readily...",4,https://s3-media1.fl.yelpcdn.com/bphoto/zXMJxswRRV4DVKjDa0Nllw/o.jpg
Thai Hut,$,"Don't judge a restaurant by its sign! 

You might not expect much from this casual joint, with their no frills exterior, but they are a solid takeout option...",5,https://s3-media4.fl.yelpcdn.com/bphoto/4Q1KJW6ym44Oaz57es9FdA/o.jpg
Tom Yum Koong,$$,"Very fast turn time on our order, everything was very good, service was quick and friendly, definitely recommend.",5,https://s3-media3.fl.yelpcdn.com/bphoto/6TJRqObCkPdBW76Funs0Wg/o.jpg
Milano's Delicatessen,$,Cool spot with great small business charm! Had lunch here with my daughter while visiting the area and was pleasantly surprised to find the spot. Was...,5,https://s3-media3.fl.yelpcdn.com/bphoto/t5V53YukY59FEMq5QWRvEw/o.jpg
Stoked Wood Fired Pizza,$,"Stoked has it down, the menu is exactly what you want from your neighborhood pizza spot ... and the beverages and cocktails are perfect every time.   I...",5,https://s3-media3.fl.yelpcdn.com/bphoto/kD4soDD1PlPULluRAo7B5g/o.jpg
Locale,$$,People wait in line for Regina's which has dropped off the cliff in quality while just up the street you can get a far superior pizza and sadly I am the...,5,https://s3-media2.fl.yelpcdn.com/bphoto/derEYD_f-F1p-O8wNaRyYg/o.jpg
Galleria Umberto,$,"Simply the best bakery(square)  pizza, arancini, panzaroti, and calzone (and all the other things.) The owner was born in Italy and has been doing this for...",5,https://s3-media1.fl.yelpcdn.com/bphoto/tNZbSM1ZOvju9zevxv_JZw/o.jpg
Mirisola's,$,"I found this place on Yelp and had no idea how mom-and-pop it was.

I visited around 11:30am on a Friday. The door was open and the TV was on, but the...",5,https://s3-media3.fl.yelpcdn.com/bphoto/8xTMuEZsoOIihTfpseoqbg/o.jpg
Casa Razdora,$,Amazing place! The staff all speak Italian and really care about the food they prepare. Same quality as restaurants in the North End with half the price.,5,https://s3-media4.fl.yelpcdn.com/bphoto/uT6YEoi-gsWBneY6q6q0mw/o.jpg
Regina Pizza,$$,One of the oldest pizzerias in Boston. The original location in the North End is still the best. The other locations are 'bene' while this location is...,5,https://s3-media1.fl.yelpcdn.com/bphoto/3gMEZUlKu7fFe8uqy0PUNQ/o.jpg
Italian Express Pizzeria,$$,"I found out last night that this restaurant had closed. 
I dont know why this restaurant is closed, but after going there to eat several times before and...",5,https://s3-media4.fl.yelpcdn.com/bphoto/eFCrELhtrnaMKhz0t3zGFw/o.jpg
Picco Pizza & Ice Cream,$$,I have been going to Piccos for almost 19 years. Now I will explain why it only gets three stars. Honestly the pizza is amazing. Which isn't even the best...,3,https://s3-media2.fl.yelpcdn.com/bphoto/PhVHbuOW1zLtWFtY8I-5SA/o.jpg
Ecco Pizzeria,$$,I went to this place last week on the way to a friend's house and I loved it. They make the best pizza I have ever had. They had a special going where you...,5,https://s3-media3.fl.yelpcdn.com/bphoto/PUCfhNQ4MDg8tqMT4C83zQ/o.jpg
OTTO,$$,"My wife and I checked tonight and since the start of the pandemic in March, 2020, we've ordered Otto's on average at least once a month. It's a great option...",5,https://s3-media2.fl.yelpcdn.com/bphoto/nv2rjiWJ1czM9GuStCY-6A/o.jpg
Santarpio's Pizza,$$,"my daughter and i went here a few weeks ago it had been many years since i was there. I must say , they did not disappoin.  service was excellent, very...",5,https://s3-media2.fl.yelpcdn.com/bphoto/uFMPfX8FF-ydkX5qOkn7iA/o.jpg
Regina Pizzeria,$,"Perhaps the best pizza in Fenway. It is pricey, but there meat lovers pizza is terrific and has more generous amounts of meat that the corresponding pizza...",5,https://s3-media1.fl.yelpcdn.com/bphoto/zH3s5yC7B5BjoN856u0Riw/o.jpg
Ernesto's,$,"Good casual pizza place. No frills but very tasty.

I've gotten pizza here a few times and each is better than the last. The staff here definitely doesn't...",5,https://s3-media4.fl.yelpcdn.com/bphoto/_ccYXGnwLsf_XlM-vaicLg/o.jpg
Crush Pizza,$$,"While in Boston, my family and I decided to take a break and order in dinner to the room. We had a craving for pizza and found Crush online. I am so glad we...",5,https://s3-media4.fl.yelpcdn.com/bphoto/rlqR4cE31P_M1Ip8nPW0QQ/o.jpg
The Salty Pig,$$,"The Salty Pig - A Boston Delight for Meat Lovers

As a self-proclaimed foodie, I'm always on the lookout for the next best dining spot. So when I heard...",5,https://s3-media2.fl.yelpcdn.com/bphoto/5UzgfJ2l3LZDBspzRrFfXw/o.jpg
DaCoopas Pizza and Subs,$,"remember the old dacopas store front sign? 
yeah... I forgot how a cheeseburger sub is so delicious freshly put together to warm up at 230am after third...",5,https://s3-media2.fl.yelpcdn.com/bphoto/U1rQx0o2TQOFwFnpUB31gQ/o.jpg
Figs by Todd English,$$,"I visited Figs with a friend for dinner, and I'm still thinking about the calamari pizza! 

Figs is known for their thin crust pizza. You have the option of...",4,https://s3-media1.fl.yelpcdn.com/bphoto/bk11dXEFQnzG36vpOSk7bQ/o.jpg
Figs by Todd English,$$,Cheese Pizza is amazing! Ate outside on a warm evening. Service is very friendly and they made a nice wine recommendation.,5,https://s3-media4.fl.yelpcdn.com/bphoto/Tz3HWEX9mXEzlZT-BU5pqA/o.jpg
Boston Kitchen Pizza,$,"Great spot with plenty of options within easy walking distance of Tuft's Medical Center. Staff is super friendly and service is quick. 

Large selection of...",5,https://s3-media3.fl.yelpcdn.com/bphoto/OL4Y0uAZVGpJLHv460UKdg/o.jpg
Donut King,$,"Nothing but the best service, great donuts, good coffee, and doors open at 4:30 am. What else can you ask for? If you are new to the area or from out of...",5,https://s3-media1.fl.yelpcdn.com/bphoto/uVG9DdlokEPSzstemREUNg/o.jpg
Kane's Donuts - Lincoln Avenue,$,this is probably my favorite donut place near the boston area. rt 1 is a pain to drive on and if you miss it you would need to get out and loop back. but...,5,https://s3-media1.fl.yelpcdn.com/bphoto/lfozExx7Z_TGKQHyGe78HA/o.jpg
Linda’s Donuts,$,"This wonderful little shop gave me the best service and restored all faith in our industry!!  The girl who served me at the counter, I so wish I had gotten...",5,https://s3-media4.fl.yelpcdn.com/bphoto/fGnMzs7YCTTYYxwO1lGmKQ/o.jpg
Daddy's Fried Dough,$,They operate the outdoor snack shack at Bradford Ski area in Haverhill MA. The fried dough is amazing! Nice people too. It was fun eating outdoors at a...,5,https://s3-media3.fl.yelpcdn.com/bphoto/BUfQChhU5c4aTJV5Kwhpjg/o.jpg
Union Square Donuts,$$,The donuts were incredible. Soooo soft fluffy and flavorful. Next time we are in this area we will be back!,5,https://s3-media1.fl.yelpcdn.com/bphoto/N-vMzW3E4c-y49fMLJQwnA/o.jpg
Demet's Donuts,$,"New sandwich bread!!!!!!
If you had their breakfast sandwich on toast or English or bagel
I highly recommend the ciabatta bread
And go for maple aioli on...",5,https://s3-media2.fl.yelpcdn.com/bphoto/NrhKPL1tYoXzvJ-shLY8Ew/o.jpg
Ohlin's Bakery,$,"We couldn't believe it when we saw on the news one morning that their oven exploded, we miss our donuts and we can't wait for this place to reopen! Great...",5,https://s3-media3.fl.yelpcdn.com/bphoto/ZC9eqC7ogPfQWWXgTPcC-g/o.jpg
Donut Villa Diner,$,"Little diner we love to go for breakfast once or more a week 
Friendly staff great service
Owner loves to say high to all
Had monte crisco French toast with...",5,https://s3-media4.fl.yelpcdn.com/bphoto/rlAa5TDc_p_zbWexRNH7eA/o.jpg
Verna's Coffee & Donut Shop,$,"Yeah these are really good donuts. Verna was not the most courteous, and when I found myself to be the only customer in the store, she acted like I was...",5,https://s3-media1.fl.yelpcdn.com/bphoto/IIU2OAGcvIAHeNZd16hURw/o.jpg
Twin Donuts,$,"Honestly this place is a little bit of a hole in the wall, the lady at the front is so funny, don't expect her to be super nice to you she's probs been...",5,https://s3-media1.fl.yelpcdn.com/bphoto/xPJLNoYn7QFCPBD7LLpvcg/o.jpg
Doughboy Donuts & Deli,$,Very good meatball subs. Could have used another meatball or two but definitely homemade meatballs so that was a plus.,4,https://s3-media4.fl.yelpcdn.com/bphoto/n1eSbnyKZZyb5LuKw3sWfQ/o.jpg
Donuts With A Difference,$,"Some foods--tacos, burgers, breakfast, donuts etc.--have two main categories: old-school and fancified. If done right, there is really nothing to recommend...",5,https://s3-media3.fl.yelpcdn.com/bphoto/8mY1--MLoEDL74cMrYtBhQ/o.jpg
Donut 'N' Donuts,$,"This place is expensive for what it is. For two coffees and 2 breakfast sandwiches, we easily spent $15. I recommend to go elsewhere. Starbucks coffee is...",3,https://s3-media2.fl.yelpcdn.com/bphoto/_KyzAa0QFgxwTdlg8QP5Gg/o.jpg
Dunkin',$,"Love this place. The lady's and the manager are the best, always ready with my coffee, my poppy is always welcome, thanks DD team",5,https://s3-media2.fl.yelpcdn.com/bphoto/8gc4Xkpz1kdRzJU8EKxwiQ/o.jpg
Mike's Donuts,$,I never would have imagined that this place would have such tasty treats...the appearance of forest hills alone doesn't really make you want to eat anything...,5,https://s3-media4.fl.yelpcdn.com/bphoto/AkDG_sggDxvp9hVNAljvqw/o.jpg
Dunkin',$,"First off let me just say that I've never written a review for a Dunkin Donuts store but felt compelled to write one after exceptional service. 

The...",5,https://s3-media3.fl.yelpcdn.com/bphoto/QbUiINFZ-A0Q26daJ4qs4A/o.jpg
Blackbird Doughnuts - South End,$$,"Came in one morning and they ran out of all the flavors I originally wanted, so I came back the next day, still didn't get the cider, but the Blackbird and...",4,https://s3-media2.fl.yelpcdn.com/bphoto/CRc_0sbpQIRZRq57dqJ8Vw/o.jpg
Dunkin' Donuts,$,"To me, the East Coast is synonymous to Dunkin' Donuts. During a summer trip to New York and Massachusetts, I was hoping to get Dunkin' on more than one...",4,https://s3-media2.fl.yelpcdn.com/bphoto/BXS5iM4U_pDxqgykkboOoQ/o.jpg
Dunkin',$,This is an incredibly convenient Dunkin Donuts - located right in Kenmore Square and around the corner from Fenway. It's surprisingly clean for its high...,4,https://s3-media1.fl.yelpcdn.com/bphoto/KU5MtADVNUGGrvN1cecMHA/o.jpg
Mike's Donuts,$,"Pros:
-Freshest dough in the city. Seriously, it's SO soft it deflates in your hands.
-The staff here continue to be awesome. I was buying a dozen donuts...",5,https://s3-media4.fl.yelpcdn.com/bphoto/b2tHduPCzhRpEiqxIEg2Ng/o.jpg
Bricco Panetteria,$,"Can't speak to the food, but the espresso martinis are soooo good here. Also their regular martinis are really yummy instead of using olive juice, I think...",5,https://s3-media3.fl.yelpcdn.com/bphoto/P4er8H-KM32yg0Ku6sPByQ/o.jpg
Parziale's Bakery,$,Fantastic.   Chocolate dipped macaroons were delicious.  Cheesecake was excellent; particularly if you prefer a less dense texture.,5,https://s3-media4.fl.yelpcdn.com/bphoto/gfM2qjOzjOMjm7-7mtUVHg/o.jpg
Maria's Pastry Shop,$,"It is by no means an exaggeration to state that Maria's is an institution. Not only is this the best cannoli spot in the North End, but it is arguably the...",5,https://s3-media2.fl.yelpcdn.com/bphoto/OUHPbcGhz5qX2APq_Yu2OQ/o.jpg
Cafe Madeleine,$$,"Absolutely perfect. The canales were perfection. Pan au chocolat was one of the lightest and crispest I've ever eaten. Macaron good too, though less...",5,https://s3-media4.fl.yelpcdn.com/bphoto/b-KTA7VrMgNucQerHFjrxA/o.jpg
Cookie Monstah - Food Truck,$,The portions are huge! I personally I can't finish anything I've gotten from this truck but it's still worth the visit!,5,https://s3-media2.fl.yelpcdn.com/bphoto/9BKkEv6v3mwoehNi2fUjCQ/o.jpg
BONAPITA,$,"We have become regulars at this place-- it is so convenient, and the food is so healthy and fresh!  
And the people who work here always greet us with big...",5,https://s3-media2.fl.yelpcdn.com/bphoto/yNnmI2n4CT87tDAbs8nKfg/o.jpg
Flour Bakery + Cafe,$$,A great south end neighborhood cafe spot! Great for quick catch-ups and a good work spot (with wifi!) during their less busy hours into the evening. The...,5,https://s3-media2.fl.yelpcdn.com/bphoto/mBzaOE4eOJ0j0bK3KBIvIA/o.jpg
Gondres Bakery,$,The fruit juices and batidas  Also they sell a variety of pastries that are difficult to find sometimes.,5,https://s3-media3.fl.yelpcdn.com/bphoto/h4x9bi7VGP1TcZ64hAYDkQ/o.jpg
Eldo Cake House,$,"We have eaten these for the last 5 years, Eldo's will be missed. Best Chinese bakery out there.",5,https://s3-media2.fl.yelpcdn.com/bphoto/SOjbM3DGKZywkSq8TwV2Vw/o.jpg
Sweet Tooth,$$,"The owner of this bakery, Glenn,  is such a sweet man I love him so much! Every time I come in here with my mom he's so quick to greet us and offer help...",5,https://s3-media3.fl.yelpcdn.com/bphoto/SpLOSWvuxPM8BOzoIhPHtw/o.jpg
Borinquen Restaurant & Cafe,$,Pernil sandwich (roast pork) with everything was delicious. Small was big enough. Came with shredded lettuce tomatoes pickles mayo ketchup and mustard....,5,https://s3-media4.fl.yelpcdn.com/bphoto/AitTTde_GByWdxdlaNXgcg/o.jpg
Mike's Pastry,$$,"Canooli is ok, too sweet for Asian. But service there is horrible. Shop ladies there lack of patience.",3,https://s3-media2.fl.yelpcdn.com/bphoto/wuC9-Asq0HY2HmtujwnNLA/o.jpg
Modern Pastry Shop,$$,"When the Italian restos near by have a wait, what do you do? Hop into Modern Pastry and enjoy some desserts prior to dinner :D We wanted to try out Modern...",5,https://s3-media4.fl.yelpcdn.com/bphoto/uKNWdwig5eGI83MyN7ss5A/o.jpg
Quinzani's Bakery,$,"I had suspected a bakery was operating in this block for the last 7 years because of the intoxicating yeasty aromas, but only stumbled across the Quinzani's...",5,https://s3-media2.fl.yelpcdn.com/bphoto/r10siJHLsujKAewm4UgHNg/o.jpg
Georgetown Cupcake,$$,Cupcakes are super good! They're unfortunately more than $4 just for a few bites and the wait was quite a bit. Worth it for a fun little splurge if you like...,4,https://s3-media2.fl.yelpcdn.com/bphoto/iF2p_88Q5TFUjoxPwMcVsg/o.jpg
Mei Sum,$,"I love going to this spot for a quick bite. The best zongzi in town (they're my grandfather's favorite!), the pastries are fresh, my only complaint is no...",4,https://s3-media1.fl.yelpcdn.com/bphoto/3fuHHHiTxPLRFg0cWEtmog/o.jpg
Yada Yada,$,Family owned place. I almost always get the grilled buffalo chicken salad. Grilled Chicken NOT the fatty chicken cutlet or breaded chicken. Very tasty and...,5,https://s3-media1.fl.yelpcdn.com/bphoto/PZZAgZ1IDDjuCIpafh8LgQ/o.jpg
,,"If you visit Boston and skip the historic North End, you're doing it wrong. You should love authentic Italian food, world class pastries and cappuccinos. If...",5,https://s3-media3.fl.yelpcdn.com/bphoto/T53Mx5HecLdb55s-G8gB1Q/o.jpg
Locale,$$,People wait in line for Regina's which has dropped off the cliff in quality while just up the street you can get a far superior pizza and sadly I am the...,5,https://s3-media2.fl.yelpcdn.com/bphoto/derEYD_f-F1p-O8wNaRyYg/o.jpg
Casa Razdora,$,Amazing place! The staff all speak Italian and really care about the food they prepare. Same quality as restaurants in the North End with half the price.,5,https://s3-media4.fl.yelpcdn.com/bphoto/uT6YEoi-gsWBneY6q6q0mw/o.jpg
Giacomo's Ristorante - Boston,$$,"Cute, authentic Italian restaurant in the North End. Cash only. Lynn was my server and she was great explaining the menu and the run down of the restaurant...",5,https://s3-media1.fl.yelpcdn.com/bphoto/YXYqFvY2lDCfGt46Bc_gLg/o.jpg
Italian Express Pizzeria,$$,"I found out last night that this restaurant had closed. 
I dont know why this restaurant is closed, but after going there to eat several times before and...",5,https://s3-media4.fl.yelpcdn.com/bphoto/eFCrELhtrnaMKhz0t3zGFw/o.jpg
Picco Pizza & Ice Cream,$$,I have been going to Piccos for almost 19 years. Now I will explain why it only gets three stars. Honestly the pizza is amazing. Which isn't even the best...,3,https://s3-media2.fl.yelpcdn.com/bphoto/PhVHbuOW1zLtWFtY8I-5SA/o.jpg
Toscano Restaurant,$$$,Favorite Spot on the Hill Great Food Atmosphere is Awesome can't go wrong With anything on the menu,5,https://s3-media4.fl.yelpcdn.com/bphoto/4GNI3CZSBwZTvMfj0658mA/o.jpg
Mario's Restaurant,$$,​ I am originally from East Boston I now live in New Hampshire it was well worth the ride the food was absolutely delicious and the desserts were awesome...,5,https://s3-media3.fl.yelpcdn.com/bphoto/EM8xCn7aTAGaxcfHPZkhGg/o.jpg
Mamma Maria,$$$,"Amazing food, amazing. Very small space. Service was excellent and friendly, meal sizes were smaller but delicious. Will be back.",4,https://s3-media4.fl.yelpcdn.com/bphoto/L1fGQjel0iHV6ZH8PBfk5Q/o.jpg
The Daily Catch,$$$,"The Daily Catch is a fantastic seafood Italian restaurant located in the heart of the city. The restaurant offers a warm and inviting atmosphere, with a...",5,https://s3-media4.fl.yelpcdn.com/bphoto/nqNaUJeWE5BlgAjMeXlhig/o.jpg
Grotto,$$$,"We journeyed to Grotto on foot for two reasons. First, this restaurant was in the Beacon Hill area where we had been walking on foot all day. And second,...",5,https://s3-media1.fl.yelpcdn.com/bphoto/LtHx-HvCEzQG0TDBk94b_w/o.jpg
Anchovies,$$,"Amazing staff, great food and healthy pours.  
The trifecta for sure! 
Try the Lasagna of the Day or one of their rotating drafts!",5,https://s3-media2.fl.yelpcdn.com/bphoto/FiAN9-k85mwb76_MfdOnHw/o.jpg
Coppa Enoteca,$$$,"Really enjoyed each visit here, particularly the pasta dishes. The following are my notes from a couple years back, posting for posterity:

Sweetbreads...",5,https://s3-media1.fl.yelpcdn.com/bphoto/WxgO4Te0H5ycUqkOWSVA6A/o.jpg
Anthony's Cafe,$,"The absolute best bacon, egg, and cheese (cheddar) on a croissant ever. Also great hours, open at I believe 5 or 6am everyday. Really great value too, not...",5,https://s3-media3.fl.yelpcdn.com/bphoto/icFyYM8heWpDwMG_RGl5IA/o.jpg
Limoncello Ristorante,$$,"The restaurant is very traditionally Italian, with amazing staff and a great atmosphere.  The food was amazing (cheese ravioli with red sauce, shrimp...",5,https://s3-media3.fl.yelpcdn.com/bphoto/oqdzY-QJnP5joONLp-E1Eg/o.jpg
Sportello,$$$,Fantastic Italian restaurant by Barbara Lynch. The rabbit and GF pasta was excellent. The lobster gnocchi is fabulous! Run here for the best gnocchi in town.,5,https://s3-media3.fl.yelpcdn.com/bphoto/P_76I7kydsX41jSJFTAWdQ/o.jpg
Pizzeria Rustico,$,"My favorite lunch spot around. I walk a long time in the rain sometimes to get these sandwiches. 

The chicken parm, meat ball, and bidabeep sandwiches are...",5,https://s3-media3.fl.yelpcdn.com/bphoto/RLp5ex3RKBNJ765LGbkADA/o.jpg
Al Dente Restaurant,$$,I got here frequently with my wife and the food is always delicious and the service is kind and welcoming.,5,https://s3-media2.fl.yelpcdn.com/bphoto/1Fka1ftpeOll7x2Jiy0VLQ/o.jpg
Banh Mi Ngon,$,Great service and very nice counter person I had the Classic Banh Mi he said I should try his favorite banh mi no. 3 with grilled pork made by him his way...,5,https://s3-media3.fl.yelpcdn.com/bphoto/H91374Vlc46Jl2BP3lZd2A/o.jpg
Banh Mi House,$,"The location is pretty sketch - falafel house used to be here but ever since they moved, its been pretty empty and low traffic. However, Banh Mi House...",5,https://s3-media1.fl.yelpcdn.com/bphoto/Fe0TI6sJkz8-3nfPaKB5-Q/o.jpg
New Saigon,$,"Our favorite pho spot by Orient Heights station.
It's very covenient to commute to! The interior isn't the prettiest, but that's how you know the food is...",5,https://s3-media2.fl.yelpcdn.com/bphoto/J8yLLgLElIBEn1R_yb4wkw/o.jpg
Fusion Bistro,$$,Fun Chelsea spot with an AMAZING atmosphere and tasty foods. The little touches (like watermelon slices in the water) are really charming and feel pampering...,5,https://s3-media1.fl.yelpcdn.com/bphoto/d_rsg48fdO4iHSAxx9MADg/o.jpg
Saigon Hut,$,Great curry.  Chefts special sauce is yummy.  The pot sticker dumpling things are as expected.&8,5,https://s3-media3.fl.yelpcdn.com/bphoto/2083hQxq8OFbJurtHKJGiQ/o.jpg
Pho Viet's,$$,Best Vietnamese food in Boston -- we love their food so much. They catered our son's 1st birthday and everything was perfect. So many people raved about the...,5,https://s3-media1.fl.yelpcdn.com/bphoto/I3YwIXU8PI4rA_g-a_MFog/o.jpg
Bon Me,$$,"Great, cheap, tasty meal.  I love the spicy peanut sauce with miso braised pork over soba noodles.  I've had it a million times and will have it a million...",4,https://s3-media2.fl.yelpcdn.com/bphoto/K9urfG2q028mtyd73u4-yw/o.jpg
Pho Basil,$$,Pho has some of the best stir fried noodles in Boston. Totally worth the $17 because of the taste and size of the plate. The noodles are clearly homemade...,5,https://s3-media3.fl.yelpcdn.com/bphoto/o5SyYRWPu3Bf8tCvn5qLMw/o.jpg
Banh Mi Ba Le,$,"Every time we visit Boston, this is a must visit. We bring coolers and ice packs with us. They've got a food station where you can have them make to order...",5,https://s3-media2.fl.yelpcdn.com/bphoto/raEIBMoCLHADrCyqCFL1pA/o.jpg
New Dong Khanh,$,"*** 5/2019 ***

It was hot, so I decided to treat myself to a watermelon shake at New Dong Khanh.  $3.50 for the smaller size.

Turns out, I wasn't the only...",4,https://s3-media3.fl.yelpcdn.com/bphoto/zVXZeW-K_DS_XjeUeFDFnQ/o.jpg
Bon Me - One Kendall Square,$,"Nice lunch dish. Healthy and fulfilling for a good price 
Try the thai limeade and the huild your own noodle or rice salad is great option",4,https://s3-media3.fl.yelpcdn.com/bphoto/Jhwc6Xbu_M6GYs4KE_VcSA/o.jpg
