Price,Review,ReviewRating,Photo
$,"I love this awesome lunch place in the Nonprofit Center building!

I'm spoiled by delicious made to order food without having to leave my office...",4,https://s3-media4.fl.yelpcdn.com/bphoto/owjCLsy0gQl_92NRQqbb_g/o.jpg
$,"Unfortunately I wasted my money. I ordered chicken kabob and falafel but in my opinion if I went to McDonalds I will eat better food.  

I am sure those who...",1,https://s3-media3.fl.yelpcdn.com/bphoto/IDrKuHEUEDFCI109GMexVA/o.jpg
$,"I lived in Cambridge for 2 years in the late 90s while doing postdoc (i.e. Post Doctoral Research, a fancy term for unemployed person with a Ph.D. degree,...",5,https://s3-media1.fl.yelpcdn.com/bphoto/Dh96T1JSCfQt7YRezpCIVQ/o.jpg
$,"Excellent people and excellent crevice! 
I worked at that place for two years and I know the business form inside. The owner always do his best to provide...",5,https://s3-media1.fl.yelpcdn.com/bphoto/A_dWJqjGRowWVU0duXhTFA/o.jpg
$,"Most of these stars are for how convenient this place is.  A couple blocks from South Station, has parking, isn't usually too insane.  It already starts...",5,https://s3-media3.fl.yelpcdn.com/bphoto/6YqrdGxcPni9SHDH2ubQrQ/o.jpg
$,"Wow this was great food! A friendly man welcomed us at the door and we were seated nearly immediately, service was prompt and the food was absolutely...",5,https://s3-media2.fl.yelpcdn.com/bphoto/4jUaGu4w_Ceie3k2oU7BIg/o.jpg
