Price,Review,ReviewRating,Photo
$$,"PROS: Fantastic food, cute plants and atmosphere, great prices
CONS: Slow service

I love this place! I've been here so many times that I've tried most of...",5,https://s3-media2.fl.yelpcdn.com/bphoto/MuihDepeEZ3LTPhW29nckg/o.jpg
$,"I ordered takeout today for lunch and it arrived about ten minutes ahead of schedule, nice and hot. Fresh, spicy, delicious. Good portions, too!

I got the...",4,https://s3-media1.fl.yelpcdn.com/bphoto/NeqMG2uYVsAG1iWRsb6tgg/o.jpg
$$,"Miss this place.    Used to live over here. Best Thai food in Boston.  There, I said it. 

I used to come here most days.... Some days, I'd eat lunch AND...",5,https://s3-media4.fl.yelpcdn.com/bphoto/tyA-_2YR1BRxRwxTPd8f8A/o.jpg
$$,"Delicious, quick lunch near BU campus. $11.78 for a Pad See Ew, coming out to $12.5 pre tip. The staff is super understanding of allergies-- they readily...",4,https://s3-media1.fl.yelpcdn.com/bphoto/zXMJxswRRV4DVKjDa0Nllw/o.jpg
$,"Don't judge a restaurant by its sign! 

You might not expect much from this casual joint, with their no frills exterior, but they are a solid takeout option...",5,https://s3-media4.fl.yelpcdn.com/bphoto/4Q1KJW6ym44Oaz57es9FdA/o.jpg
$$,"Very fast turn time on our order, everything was very good, service was quick and friendly, definitely recommend.",5,https://s3-media3.fl.yelpcdn.com/bphoto/6TJRqObCkPdBW76Funs0Wg/o.jpg
$,Cool spot with great small business charm! Had lunch here with my daughter while visiting the area and was pleasantly surprised to find the spot. Was...,5,https://s3-media3.fl.yelpcdn.com/bphoto/t5V53YukY59FEMq5QWRvEw/o.jpg
$,"Stoked has it down, the menu is exactly what you want from your neighborhood pizza spot ... and the beverages and cocktails are perfect every time.   I...",5,https://s3-media3.fl.yelpcdn.com/bphoto/kD4soDD1PlPULluRAo7B5g/o.jpg
$$,People wait in line for Regina's which has dropped off the cliff in quality while just up the street you can get a far superior pizza and sadly I am the...,5,https://s3-media2.fl.yelpcdn.com/bphoto/derEYD_f-F1p-O8wNaRyYg/o.jpg
$,"Simply the best bakery(square)  pizza, arancini, panzaroti, and calzone (and all the other things.) The owner was born in Italy and has been doing this for...",5,https://s3-media1.fl.yelpcdn.com/bphoto/tNZbSM1ZOvju9zevxv_JZw/o.jpg
$,"I found this place on Yelp and had no idea how mom-and-pop it was.

I visited around 11:30am on a Friday. The door was open and the TV was on, but the...",5,https://s3-media3.fl.yelpcdn.com/bphoto/8xTMuEZsoOIihTfpseoqbg/o.jpg
$,Amazing place! The staff all speak Italian and really care about the food they prepare. Same quality as restaurants in the North End with half the price.,5,https://s3-media4.fl.yelpcdn.com/bphoto/uT6YEoi-gsWBneY6q6q0mw/o.jpg
$$,One of the oldest pizzerias in Boston. The original location in the North End is still the best. The other locations are 'bene' while this location is...,5,https://s3-media1.fl.yelpcdn.com/bphoto/3gMEZUlKu7fFe8uqy0PUNQ/o.jpg
$$,"I found out last night that this restaurant had closed. 
I dont know why this restaurant is closed, but after going there to eat several times before and...",5,https://s3-media4.fl.yelpcdn.com/bphoto/eFCrELhtrnaMKhz0t3zGFw/o.jpg
$$,I have been going to Piccos for almost 19 years. Now I will explain why it only gets three stars. Honestly the pizza is amazing. Which isn't even the best...,3,https://s3-media2.fl.yelpcdn.com/bphoto/PhVHbuOW1zLtWFtY8I-5SA/o.jpg
$$,I went to this place last week on the way to a friend's house and I loved it. They make the best pizza I have ever had. They had a special going where you...,5,https://s3-media3.fl.yelpcdn.com/bphoto/PUCfhNQ4MDg8tqMT4C83zQ/o.jpg
$$,"My wife and I checked tonight and since the start of the pandemic in March, 2020, we've ordered Otto's on average at least once a month. It's a great option...",5,https://s3-media2.fl.yelpcdn.com/bphoto/nv2rjiWJ1czM9GuStCY-6A/o.jpg
$$,"my daughter and i went here a few weeks ago it had been many years since i was there. I must say , they did not disappoin.  service was excellent, very...",5,https://s3-media2.fl.yelpcdn.com/bphoto/uFMPfX8FF-ydkX5qOkn7iA/o.jpg
$,"Perhaps the best pizza in Fenway. It is pricey, but there meat lovers pizza is terrific and has more generous amounts of meat that the corresponding pizza...",5,https://s3-media1.fl.yelpcdn.com/bphoto/zH3s5yC7B5BjoN856u0Riw/o.jpg
$,"Good casual pizza place. No frills but very tasty.

I've gotten pizza here a few times and each is better than the last. The staff here definitely doesn't...",5,https://s3-media4.fl.yelpcdn.com/bphoto/_ccYXGnwLsf_XlM-vaicLg/o.jpg
$$,"While in Boston, my family and I decided to take a break and order in dinner to the room. We had a craving for pizza and found Crush online. I am so glad we...",5,https://s3-media4.fl.yelpcdn.com/bphoto/rlqR4cE31P_M1Ip8nPW0QQ/o.jpg
$$,"The Salty Pig - A Boston Delight for Meat Lovers

As a self-proclaimed foodie, I'm always on the lookout for the next best dining spot. So when I heard...",5,https://s3-media2.fl.yelpcdn.com/bphoto/5UzgfJ2l3LZDBspzRrFfXw/o.jpg
$,"remember the old dacopas store front sign? 
yeah... I forgot how a cheeseburger sub is so delicious freshly put together to warm up at 230am after third...",5,https://s3-media2.fl.yelpcdn.com/bphoto/U1rQx0o2TQOFwFnpUB31gQ/o.jpg
$$,"I visited Figs with a friend for dinner, and I'm still thinking about the calamari pizza! 

Figs is known for their thin crust pizza. You have the option of...",4,https://s3-media1.fl.yelpcdn.com/bphoto/bk11dXEFQnzG36vpOSk7bQ/o.jpg
$$,Cheese Pizza is amazing! Ate outside on a warm evening. Service is very friendly and they made a nice wine recommendation.,5,https://s3-media4.fl.yelpcdn.com/bphoto/Tz3HWEX9mXEzlZT-BU5pqA/o.jpg
$,"Great spot with plenty of options within easy walking distance of Tuft's Medical Center. Staff is super friendly and service is quick. 

Large selection of...",5,https://s3-media3.fl.yelpcdn.com/bphoto/OL4Y0uAZVGpJLHv460UKdg/o.jpg
$,"Nothing but the best service, great donuts, good coffee, and doors open at 4:30 am. What else can you ask for? If you are new to the area or from out of...",5,https://s3-media1.fl.yelpcdn.com/bphoto/uVG9DdlokEPSzstemREUNg/o.jpg
$,this is probably my favorite donut place near the boston area. rt 1 is a pain to drive on and if you miss it you would need to get out and loop back. but...,5,https://s3-media1.fl.yelpcdn.com/bphoto/lfozExx7Z_TGKQHyGe78HA/o.jpg
$,"This wonderful little shop gave me the best service and restored all faith in our industry!!  The girl who served me at the counter, I so wish I had gotten...",5,https://s3-media4.fl.yelpcdn.com/bphoto/fGnMzs7YCTTYYxwO1lGmKQ/o.jpg
$,They operate the outdoor snack shack at Bradford Ski area in Haverhill MA. The fried dough is amazing! Nice people too. It was fun eating outdoors at a...,5,https://s3-media3.fl.yelpcdn.com/bphoto/BUfQChhU5c4aTJV5Kwhpjg/o.jpg
$$,The donuts were incredible. Soooo soft fluffy and flavorful. Next time we are in this area we will be back!,5,https://s3-media1.fl.yelpcdn.com/bphoto/N-vMzW3E4c-y49fMLJQwnA/o.jpg
$,"New sandwich bread!!!!!!
If you had their breakfast sandwich on toast or English or bagel
I highly recommend the ciabatta bread
And go for maple aioli on...",5,https://s3-media2.fl.yelpcdn.com/bphoto/NrhKPL1tYoXzvJ-shLY8Ew/o.jpg
$,"We couldn't believe it when we saw on the news one morning that their oven exploded, we miss our donuts and we can't wait for this place to reopen! Great...",5,https://s3-media3.fl.yelpcdn.com/bphoto/ZC9eqC7ogPfQWWXgTPcC-g/o.jpg
$,"Little diner we love to go for breakfast once or more a week 
Friendly staff great service
Owner loves to say high to all
Had monte crisco French toast with...",5,https://s3-media4.fl.yelpcdn.com/bphoto/rlAa5TDc_p_zbWexRNH7eA/o.jpg
$,"Yeah these are really good donuts. Verna was not the most courteous, and when I found myself to be the only customer in the store, she acted like I was...",5,https://s3-media1.fl.yelpcdn.com/bphoto/IIU2OAGcvIAHeNZd16hURw/o.jpg
$,"Honestly this place is a little bit of a hole in the wall, the lady at the front is so funny, don't expect her to be super nice to you she's probs been...",5,https://s3-media1.fl.yelpcdn.com/bphoto/xPJLNoYn7QFCPBD7LLpvcg/o.jpg
$,Very good meatball subs. Could have used another meatball or two but definitely homemade meatballs so that was a plus.,4,https://s3-media4.fl.yelpcdn.com/bphoto/n1eSbnyKZZyb5LuKw3sWfQ/o.jpg
$,"Some foods--tacos, burgers, breakfast, donuts etc.--have two main categories: old-school and fancified. If done right, there is really nothing to recommend...",5,https://s3-media3.fl.yelpcdn.com/bphoto/8mY1--MLoEDL74cMrYtBhQ/o.jpg
$,"This place is expensive for what it is. For two coffees and 2 breakfast sandwiches, we easily spent $15. I recommend to go elsewhere. Starbucks coffee is...",3,https://s3-media2.fl.yelpcdn.com/bphoto/_KyzAa0QFgxwTdlg8QP5Gg/o.jpg
$,"Love this place. The lady's and the manager are the best, always ready with my coffee, my poppy is always welcome, thanks DD team",5,https://s3-media2.fl.yelpcdn.com/bphoto/8gc4Xkpz1kdRzJU8EKxwiQ/o.jpg
$,I never would have imagined that this place would have such tasty treats...the appearance of forest hills alone doesn't really make you want to eat anything...,5,https://s3-media4.fl.yelpcdn.com/bphoto/AkDG_sggDxvp9hVNAljvqw/o.jpg
$,"First off let me just say that I've never written a review for a Dunkin Donuts store but felt compelled to write one after exceptional service. 

The...",5,https://s3-media3.fl.yelpcdn.com/bphoto/QbUiINFZ-A0Q26daJ4qs4A/o.jpg
$$,"Came in one morning and they ran out of all the flavors I originally wanted, so I came back the next day, still didn't get the cider, but the Blackbird and...",4,https://s3-media2.fl.yelpcdn.com/bphoto/CRc_0sbpQIRZRq57dqJ8Vw/o.jpg
$,"To me, the East Coast is synonymous to Dunkin' Donuts. During a summer trip to New York and Massachusetts, I was hoping to get Dunkin' on more than one...",4,https://s3-media2.fl.yelpcdn.com/bphoto/BXS5iM4U_pDxqgykkboOoQ/o.jpg
$,This is an incredibly convenient Dunkin Donuts - located right in Kenmore Square and around the corner from Fenway. It's surprisingly clean for its high...,4,https://s3-media1.fl.yelpcdn.com/bphoto/KU5MtADVNUGGrvN1cecMHA/o.jpg
$,"Pros:
-Freshest dough in the city. Seriously, it's SO soft it deflates in your hands.
-The staff here continue to be awesome. I was buying a dozen donuts...",5,https://s3-media4.fl.yelpcdn.com/bphoto/b2tHduPCzhRpEiqxIEg2Ng/o.jpg
$,"Can't speak to the food, but the espresso martinis are soooo good here. Also their regular martinis are really yummy instead of using olive juice, I think...",5,https://s3-media3.fl.yelpcdn.com/bphoto/P4er8H-KM32yg0Ku6sPByQ/o.jpg
$,Fantastic.   Chocolate dipped macaroons were delicious.  Cheesecake was excellent; particularly if you prefer a less dense texture.,5,https://s3-media4.fl.yelpcdn.com/bphoto/gfM2qjOzjOMjm7-7mtUVHg/o.jpg
$,"It is by no means an exaggeration to state that Maria's is an institution. Not only is this the best cannoli spot in the North End, but it is arguably the...",5,https://s3-media2.fl.yelpcdn.com/bphoto/OUHPbcGhz5qX2APq_Yu2OQ/o.jpg
$$,"Absolutely perfect. The canales were perfection. Pan au chocolat was one of the lightest and crispest I've ever eaten. Macaron good too, though less...",5,https://s3-media4.fl.yelpcdn.com/bphoto/b-KTA7VrMgNucQerHFjrxA/o.jpg
$,The portions are huge! I personally I can't finish anything I've gotten from this truck but it's still worth the visit!,5,https://s3-media2.fl.yelpcdn.com/bphoto/9BKkEv6v3mwoehNi2fUjCQ/o.jpg
$,"We have become regulars at this place-- it is so convenient, and the food is so healthy and fresh!  
And the people who work here always greet us with big...",5,https://s3-media2.fl.yelpcdn.com/bphoto/yNnmI2n4CT87tDAbs8nKfg/o.jpg
$$,A great south end neighborhood cafe spot! Great for quick catch-ups and a good work spot (with wifi!) during their less busy hours into the evening. The...,5,https://s3-media2.fl.yelpcdn.com/bphoto/mBzaOE4eOJ0j0bK3KBIvIA/o.jpg
$,The fruit juices and batidas  Also they sell a variety of pastries that are difficult to find sometimes.,5,https://s3-media3.fl.yelpcdn.com/bphoto/h4x9bi7VGP1TcZ64hAYDkQ/o.jpg
$,"We have eaten these for the last 5 years, Eldo's will be missed. Best Chinese bakery out there.",5,https://s3-media2.fl.yelpcdn.com/bphoto/SOjbM3DGKZywkSq8TwV2Vw/o.jpg
$$,"The owner of this bakery, Glenn,  is such a sweet man I love him so much! Every time I come in here with my mom he's so quick to greet us and offer help...",5,https://s3-media3.fl.yelpcdn.com/bphoto/SpLOSWvuxPM8BOzoIhPHtw/o.jpg
$,Pernil sandwich (roast pork) with everything was delicious. Small was big enough. Came with shredded lettuce tomatoes pickles mayo ketchup and mustard....,5,https://s3-media4.fl.yelpcdn.com/bphoto/AitTTde_GByWdxdlaNXgcg/o.jpg
$$,"Canooli is ok, too sweet for Asian. But service there is horrible. Shop ladies there lack of patience.",3,https://s3-media2.fl.yelpcdn.com/bphoto/wuC9-Asq0HY2HmtujwnNLA/o.jpg
$$,"It's all here. 
There are the pastries, cakes and cookies. I'm not going bore you with who has the best cannoli, blah blah. 
Just go here with your CASH and...",5,https://s3-media4.fl.yelpcdn.com/bphoto/uKNWdwig5eGI83MyN7ss5A/o.jpg
$,"I had suspected a bakery was operating in this block for the last 7 years because of the intoxicating yeasty aromas, but only stumbled across the Quinzani's...",5,https://s3-media2.fl.yelpcdn.com/bphoto/r10siJHLsujKAewm4UgHNg/o.jpg
$$,When I have a Sweet Tooth I like to come here for a sweet treat. These cupcakes are the perfect sugar rush inducing treats your palate is looking for. With...,5,https://s3-media2.fl.yelpcdn.com/bphoto/iF2p_88Q5TFUjoxPwMcVsg/o.jpg
$,"I love going to this spot for a quick bite. The best zongzi in town (they're my grandfather's favorite!), the pastries are fresh, my only complaint is no...",4,https://s3-media1.fl.yelpcdn.com/bphoto/3fuHHHiTxPLRFg0cWEtmog/o.jpg
$,Family owned place. I almost always get the grilled buffalo chicken salad. Grilled Chicken NOT the fatty chicken cutlet or breaded chicken. Very tasty and...,5,https://s3-media1.fl.yelpcdn.com/bphoto/PZZAgZ1IDDjuCIpafh8LgQ/o.jpg
,"If you visit Boston and skip the historic North End, you're doing it wrong. You should love authentic Italian food, world class pastries and cappuccinos. If...",5,https://s3-media3.fl.yelpcdn.com/bphoto/T53Mx5HecLdb55s-G8gB1Q/o.jpg
$$,People wait in line for Regina's which has dropped off the cliff in quality while just up the street you can get a far superior pizza and sadly I am the...,5,https://s3-media2.fl.yelpcdn.com/bphoto/derEYD_f-F1p-O8wNaRyYg/o.jpg
$,Amazing place! The staff all speak Italian and really care about the food they prepare. Same quality as restaurants in the North End with half the price.,5,https://s3-media4.fl.yelpcdn.com/bphoto/uT6YEoi-gsWBneY6q6q0mw/o.jpg
$$,"Cute, authentic Italian restaurant in the North End. Cash only. Lynn was my server and she was great explaining the menu and the run down of the restaurant...",5,https://s3-media1.fl.yelpcdn.com/bphoto/YXYqFvY2lDCfGt46Bc_gLg/o.jpg
$$,"I found out last night that this restaurant had closed. 
I dont know why this restaurant is closed, but after going there to eat several times before and...",5,https://s3-media4.fl.yelpcdn.com/bphoto/eFCrELhtrnaMKhz0t3zGFw/o.jpg
$$,I have been going to Piccos for almost 19 years. Now I will explain why it only gets three stars. Honestly the pizza is amazing. Which isn't even the best...,3,https://s3-media2.fl.yelpcdn.com/bphoto/PhVHbuOW1zLtWFtY8I-5SA/o.jpg
$$$,Favorite Spot on the Hill Great Food Atmosphere is Awesome can't go wrong With anything on the menu,5,https://s3-media4.fl.yelpcdn.com/bphoto/4GNI3CZSBwZTvMfj0658mA/o.jpg
$$,​ I am originally from East Boston I now live in New Hampshire it was well worth the ride the food was absolutely delicious and the desserts were awesome...,5,https://s3-media3.fl.yelpcdn.com/bphoto/EM8xCn7aTAGaxcfHPZkhGg/o.jpg
$$$,I came here last night for a friend's birthday and the food as absolutely phenomenal. She made a week-of reservation and was able to grab an 8pm...,5,https://s3-media4.fl.yelpcdn.com/bphoto/L1fGQjel0iHV6ZH8PBfk5Q/o.jpg
$$$,"The Daily Catch is a fantastic seafood Italian restaurant located in the heart of the city. The restaurant offers a warm and inviting atmosphere, with a...",5,https://s3-media4.fl.yelpcdn.com/bphoto/nqNaUJeWE5BlgAjMeXlhig/o.jpg
$$$,"We journeyed to Grotto on foot for two reasons. First, this restaurant was in the Beacon Hill area where we had been walking on foot all day. And second,...",5,https://s3-media1.fl.yelpcdn.com/bphoto/LtHx-HvCEzQG0TDBk94b_w/o.jpg
$$,"Amazing staff, great food and healthy pours.  
The trifecta for sure! 
Try the Lasagna of the Day or one of their rotating drafts!",5,https://s3-media2.fl.yelpcdn.com/bphoto/FiAN9-k85mwb76_MfdOnHw/o.jpg
$$$,"Really enjoyed each visit here, particularly the pasta dishes. The following are my notes from a couple years back, posting for posterity:

Sweetbreads...",5,https://s3-media1.fl.yelpcdn.com/bphoto/WxgO4Te0H5ycUqkOWSVA6A/o.jpg
$,"The absolute best bacon, egg, and cheese (cheddar) on a croissant ever. Also great hours, open at I believe 5 or 6am everyday. Really great value too, not...",5,https://s3-media3.fl.yelpcdn.com/bphoto/icFyYM8heWpDwMG_RGl5IA/o.jpg
$$,"The restaurant is very traditionally Italian, with amazing staff and a great atmosphere.  The food was amazing (cheese ravioli with red sauce, shrimp...",5,https://s3-media3.fl.yelpcdn.com/bphoto/oqdzY-QJnP5joONLp-E1Eg/o.jpg
$$$,Fantastic Italian restaurant by Barbara Lynch. The rabbit and GF pasta was excellent. The lobster gnocchi is fabulous! Run here for the best gnocchi in town.,5,https://s3-media3.fl.yelpcdn.com/bphoto/P_76I7kydsX41jSJFTAWdQ/o.jpg
$,"My favorite lunch spot around. I walk a long time in the rain sometimes to get these sandwiches. 

The chicken parm, meat ball, and bidabeep sandwiches are...",5,https://s3-media3.fl.yelpcdn.com/bphoto/RLp5ex3RKBNJ765LGbkADA/o.jpg
$$,I got here frequently with my wife and the food is always delicious and the service is kind and welcoming.,5,https://s3-media2.fl.yelpcdn.com/bphoto/1Fka1ftpeOll7x2Jiy0VLQ/o.jpg
$,"I stopped into this place for the first time today, so I got the classic banh mi sandwich to feel things out. I really liked it-- the different sliced cold...",5,https://s3-media3.fl.yelpcdn.com/bphoto/H91374Vlc46Jl2BP3lZd2A/o.jpg
$,"The location is pretty sketch - falafel house used to be here but ever since they moved, its been pretty empty and low traffic. However, Banh Mi House...",5,https://s3-media1.fl.yelpcdn.com/bphoto/Fe0TI6sJkz8-3nfPaKB5-Q/o.jpg
$,"Our favorite pho spot by Orient Heights station.
It's very covenient to commute to! The interior isn't the prettiest, but that's how you know the food is...",5,https://s3-media2.fl.yelpcdn.com/bphoto/J8yLLgLElIBEn1R_yb4wkw/o.jpg
$$,Fun Chelsea spot with an AMAZING atmosphere and tasty foods. The little touches (like watermelon slices in the water) are really charming and feel pampering...,5,https://s3-media1.fl.yelpcdn.com/bphoto/d_rsg48fdO4iHSAxx9MADg/o.jpg
$,Great curry.  Chefts special sauce is yummy.  The pot sticker dumpling things are as expected.&8,5,https://s3-media3.fl.yelpcdn.com/bphoto/2083hQxq8OFbJurtHKJGiQ/o.jpg
$$,Best Vietnamese food in Boston -- we love their food so much. They catered our son's 1st birthday and everything was perfect. So many people raved about the...,5,https://s3-media1.fl.yelpcdn.com/bphoto/I3YwIXU8PI4rA_g-a_MFog/o.jpg
$$,"Great, cheap, tasty meal.  I love the spicy peanut sauce with miso braised pork over soba noodles.  I've had it a million times and will have it a million...",4,https://s3-media2.fl.yelpcdn.com/bphoto/K9urfG2q028mtyd73u4-yw/o.jpg
$$,Pho has some of the best stir fried noodles in Boston. Totally worth the $17 because of the taste and size of the plate. The noodles are clearly homemade...,5,https://s3-media3.fl.yelpcdn.com/bphoto/o5SyYRWPu3Bf8tCvn5qLMw/o.jpg
$,"Every time we visit Boston, this is a must visit. We bring coolers and ice packs with us. They've got a food station where you can have them make to order...",5,https://s3-media2.fl.yelpcdn.com/bphoto/raEIBMoCLHADrCyqCFL1pA/o.jpg
$,"*** 5/2019 ***

It was hot, so I decided to treat myself to a watermelon shake at New Dong Khanh.  $3.50 for the smaller size.

Turns out, I wasn't the only...",4,https://s3-media3.fl.yelpcdn.com/bphoto/zVXZeW-K_DS_XjeUeFDFnQ/o.jpg
$,"Nice lunch dish. Healthy and fulfilling for a good price 
Try the thai limeade and the huild your own noodle or rice salad is great option",4,https://s3-media3.fl.yelpcdn.com/bphoto/Jhwc6Xbu_M6GYs4KE_VcSA/o.jpg
$$,I live few-min walk away from the restaurant but finally decided to give it a try. Tbh I was a little skeptical as I had the idea that a Vietnamese...,4,https://s3-media3.fl.yelpcdn.com/bphoto/DdGOnV4F58PT2cDG-1i_sA/o.jpg
$$,"Cute and cozy hole in the wall with delicious food.

Keep an eye out for Beantown Pho and Grill the next time you walk down Newbury St. If you're not paying...",5,https://s3-media2.fl.yelpcdn.com/bphoto/vaLclH4XZ38lHaSLb6sP5Q/o.jpg
$,Came here with my friends and got the seven course beef which is basically 7 different meat dishes. Two of them you cook yourself by dipping the meat in...,5,https://s3-media2.fl.yelpcdn.com/bphoto/91A9ysW92ZpgYFa8xp_N-A/o.jpg
$,"I highly recommend the Bo Ne. My four star is for this dish alone. This is beef steak sautéed onion with butter, pate, and a sunny side up egg. It is served...",4,https://s3-media3.fl.yelpcdn.com/bphoto/m7cd1Rui3dblu_w0Wj4euA/o.jpg
$,"TLDR: killer take out banh mi. Cash only 

Love this place. Sandwiches are $5 with tax. I haven't tried all the varieties yet but the ones I've tried are...",5,https://s3-media2.fl.yelpcdn.com/bphoto/_OGHZyUwAHbjHeBbtyzQyw/o.jpg
$$,"Great portion, authentic pho and friendly quick service. Worth a visit! 

The menu is expansive and good quality.",5,https://s3-media1.fl.yelpcdn.com/bphoto/tiJRA3JfI3YHi-9oxIZKoA/o.jpg
$$,"Great, cheap, tasty meal.  I love the spicy peanut sauce with miso braised pork over soba noodles.  I've had it a million times and will have it a million...",4,https://s3-media2.fl.yelpcdn.com/bphoto/K9urfG2q028mtyd73u4-yw/o.jpg
$,"Love Vietamese food, and finding this food truck was a happy serendipity.

Bon Me happened to be in my pathway on my way back to my hotel, where I was going...",4,https://s3-media3.fl.yelpcdn.com/bphoto/8On64m6yBTwgYjvy9VQOIA/o.jpg
$$,"One of the best places to get Vietnamese food. Saddened by their closure and hope that local and regional food cuisines can survive here in Boston.

Until...",5,https://s3-media1.fl.yelpcdn.com/bphoto/vxouIMMibBgPal1wNdpwnw/o.jpg
$$,"Best. Yogurt. Ever. If all the other reviews don't convince you to come try it out, let it be mine that screams from the rooftops, This is better than...",5,https://s3-media2.fl.yelpcdn.com/bphoto/FTS3BBMZvUBbxA4_1iLIHA/o.jpg
$,Great fresh ravioli and pasta. I definitely will be back soon to try some more kinds.,5,https://s3-media2.fl.yelpcdn.com/bphoto/nIaz07SngbDphdIYksgI3A/o.jpg
$$,"Food - you get a great variety and high quality Mediterranean food. I was so happy to find all kinds of wheat, fresh salad, cheese, pastry. 

Ambiance -...",5,https://s3-media2.fl.yelpcdn.com/bphoto/LGUMm0Uc41Yt100ubtaSlQ/o.jpg
$,I lived in Boston for 7 years but only came here for the first time on a visit back to see friends. I can't believe it took me so long! The food was...,5,https://s3-media4.fl.yelpcdn.com/bphoto/Ejb-ejEPKUUCv3RQ1BqqxQ/o.jpg
$$,My boyfriend and I went here to just check it out to see what they had and BOY were we surprised. The space looks small from the street but extends far back...,5,https://s3-media2.fl.yelpcdn.com/bphoto/UQTngUrRqfVaI1_iXTGPng/o.jpg
$$,"This place is magic.

It's super unassuming, and I've definitely walked right by it even when I've been looking for it.  The name ""Reliable Market"" makes me...",5,https://s3-media1.fl.yelpcdn.com/bphoto/OObOpKqEVrXqGaE1wESpsw/o.jpg
$$,"I really kind of want to keep this simple.  Two questions.

1) Do you like pierogies?
2) Do you like kielbasa?

If the answer to either one of those...",5,https://s3-media2.fl.yelpcdn.com/bphoto/rqYXrvGFBhJ9YY-TrGgorg/o.jpg
$$,Great source for Euro Cadbury chocalates. We visited 2 weeks before Easter and there were so many fun bunny themed chocolates! Aero choc and so many others...,5,https://s3-media2.fl.yelpcdn.com/bphoto/crqxvJYIW7vBbLL6hnoluA/o.jpg
$,"Authentic and fresh! The menu has a good amount of options. 

The tacos and burritos are staples and are delicious. Pollo asado is also a good choice, for...",5,https://s3-media3.fl.yelpcdn.com/bphoto/_DBMhc7GZvXWyRObcs8L8w/o.jpg
$$,For a long time after arriving in he Boston-Cambridge area my friends recommended this place for me.  I am an adventurous cook and always need rare spices...,5,https://s3-media4.fl.yelpcdn.com/bphoto/IeVJt8yZWZdcY2KCXRwPSA/o.jpg
$,Looking for Polish sausages we found this place. Friendly service and a nice selection of Polish foods and meats! We will be back!,5,https://s3-media4.fl.yelpcdn.com/bphoto/24YaYnpGbjz3QXwh59_A1A/o.jpg
$,"The Lamejun (not sure which spelling to use, there are so many) is fantastic. The bouregs are amazing Great selection and a long-time staple.",5,https://s3-media2.fl.yelpcdn.com/bphoto/-fBExemYC8AKmRylmFexYw/o.jpg
$,After a fun and fabulous night at Ryan Landry's gold dust orphans show up on the third floor we wandered down to find the basement  kitchen. Our first time...,5,https://s3-media1.fl.yelpcdn.com/bphoto/G31gGQiOSIXmCqZAea6lFg/o.jpg
